<!DOCTYPE meta-models SYSTEM "meta-model.dtd" >
<meta-models examplefile="example/demo.xml">

	<object id="BasicRepresentation" instanciable="yes" keyfield="id" exampleid="myUseCase" package="UML">		
		<description>
			Describes an action in an activity diagram
		</description>
		<properties>
			<!--property id="Id" type="java.lang.String" ismetaclassinstance="no" iscollection="no">
				<label lang="es">Descripcion</label>
				<label lang="en">Description</label>
			</property-->
			<property id="SmallIcon" type="java.lang.String" ismetaclassinstance="no" iscollection="no">
				<label lang="es">Descripcion</label>
				<label lang="en">Description</label>
			</property>
			<property id="NormalIcon" type="java.lang.String" ismetaclassinstance="no" iscollection="no">
				<label lang="es">Descripcion</label>
				<label lang="en">Description</label>
			</property>
			<preferredorder>
				<order>id</order>
				<order>SmallIcon</order>
				<order>NormalIcon</order>
			</preferredorder>
		</properties>
		<graphics>
			<small-icon>images/basvisualrepr.gif</small-icon>
			<normal-icon>images/iusecase.gif</normal-icon>
			<layout>					
				<properties>
					<property id="id" />
					<property id="SmallIcon" />
					<property id="NormalIcon" />
				</properties>
				<views>
					<content id="UML">
						##panel layout="BorderLayout(0,0)"  Background="white" border="LineBorder(Color.black,1)"#
						##vbox Background="white" constraints="BorderLayout.CENTER" #
						##panel Background="white"  HorizontalAlignment="CENTER" layout="FlowLayout(FlowLayout.CENTER,0,0)" #
						##stereotype text="BasicRepresentation" HorizontalAlignment="CENTER" /#
						##/panel #
						##panel Background="white"  HorizontalAlignment="CENTER"  layout="FlowLayout(FlowLayout.CENTER,0,0)" #
						##label id="Id"/#
						##/panel#
						##linepanel Background="white"/#
						##panel Background="white"  HorizontalAlignment="CENTER"  layout="FlowLayout(FlowLayout.LEFT,0,0)" #
						##label text="SmallIcon:"/#
						##label id="SmallIcon"/#
						##/panel#
						##panel Background="white"  HorizontalAlignment="CENTER"  layout="FlowLayout(FlowLayout.LEFT,0,0)" #
						##label text="NormalIcon:"/#
						##label id="NormalIcon"/#
						##/panel#
						##linepanel Background="white" /#
						##/vbox#
						##/panel#	
					</content>
					<content id="INGENIAS">
						##panel layout="BorderLayout(0,0)"  Background="white" border="LineBorder(Color.black,1)"#
						##vbox Background="white" constraints="BorderLayout.CENTER" #
						##panel Background="white"  HorizontalAlignment="CENTER" layout="FlowLayout(FlowLayout.CENTER,0,0)" #
						##stereotype text="BasicRepresentation" HorizontalAlignment="CENTER" /#
						##/panel #
						##panel Background="white"  HorizontalAlignment="CENTER"  layout="FlowLayout(FlowLayout.CENTER,0,0)" #
						##label id="Id"/#
						##/panel#
						##linepanel Background="white"/#
						##linepanel Background="white" /#
						##/vbox#
						##/panel#	
					</content>
				</views>					
			</layout>
		</graphics>
	</object>
	
	<object id="VisualRepresentation" instanciable="yes" keyfield="id" exampleid="myUseCase" package="UML">		
		<description>
			Describes an action in an activity diagram
		</description>
		<properties>
			<!--property id="Id" type="java.lang.String" ismetaclassinstance="no" iscollection="no">
				<label lang="es">Descripcion</label>
				<label lang="en">Description</label>
			</property-->
			<property id="GenericId" type="java.lang.String" ismetaclassinstance="no" iscollection="no">
				<label lang="es">Descripcion</label>
				<label lang="en">Description</label>
			</property>
			<property id="Content" type="java.lang.String" ismetaclassinstance="no" iscollection="no" preferredwidget="ingenias.editor.widget.ScrolledTArea">
				<label lang="es">Descripcion</label>
				<label lang="en">Description</label>
			</property>
			<preferredorder>
				<order>id</order>
				<order>GenericId</order>
				<order>Content</order>
			</preferredorder>
		</properties>
		<graphics>
			<small-icon>images/visualrepr.gif</small-icon>
			<normal-icon>images/iusecase.gif</normal-icon>
			<layout>					
				<properties>
					<property id="id" />
					<property id="GenericId" />
					<property id="Content" />
				</properties>
				<views>
					<content id="UML">
						##panel layout="BorderLayout(0,0)"  Background="white" border="LineBorder(Color.black,1)"#
						##vbox Background="white" constraints="BorderLayout.CENTER" #
						##panel Background="white"  HorizontalAlignment="CENTER" layout="FlowLayout(FlowLayout.CENTER,0,0)" #
						##stereotype text="VisualRepresentation" HorizontalAlignment="CENTER" /#
						##/panel #
						##panel Background="white"  HorizontalAlignment="CENTER"  layout="FlowLayout(FlowLayout.CENTER,0,0)" #
						##label id="Id"/#
						##label text=":"/#
						##label id="GenericId"/#
						##/panel#
						##linepanel Background="white"/#
						##textarea id="Content" border="LineBorder(Color.black,2)"/#
						##linepanel Background="white" /#
						##/vbox#
						##/panel#	
					</content>
					<content id="INGENIAS">
						##panel layout="BorderLayout(0,0)"  Background="white" border="LineBorder(Color.black,1)"#
						##vbox Background="white" constraints="BorderLayout.CENTER" #
						##panel Background="white"  HorizontalAlignment="CENTER" layout="FlowLayout(FlowLayout.CENTER,0,0)" #
						##stereotype text="VisualRepresentation" HorizontalAlignment="CENTER" /#
						##/panel #
						##panel Background="white"  HorizontalAlignment="CENTER"  layout="FlowLayout(FlowLayout.CENTER,0,0)" #
						##label id="Id"/#
						##label text=":"/#
						##label id="GenericId"/#
						##/panel#
						##linepanel Background="white" /#
						##/vbox#
						##/panel#	
					</content>
				</views>					
			</layout>
		</graphics>
	</object>
	
	<object id="TypeWrapper" instanciable="no" keyfield="Id" exampleid="myUseCase" package="UML">		
		<description>
			Describes an action in an activity diagram
		</description>
		<properties>
			
			<preferredorder>
				<order>id</order>
			</preferredorder>
		</properties>
		<graphics>
			<small-icon>images/miusecase.gif</small-icon>
			<normal-icon>images/iusecase.gif</normal-icon>
			<layout>					
				<properties>
					<property id="id" />
				</properties>
				<views/>
				
			</layout>
		</graphics>
	</object>
	
	<object id="MetaObjectTypeWrapper" inherits="TypeWrapper" instanciable="yes" keyfield="MetaObjectType" exampleid="myUseCase" package="UML">		
		<description>
			Describes an action in an activity diagram
		</description>
		<properties>
			
			<property id="MetaObjectType" type="MetaObject" ismetaclassinstance="yes" iscollection="no">
				<label lang="es">Descripcion</label>
				<label lang="en">Description</label>
			</property>				
			<property id="Iscollection" type="java.lang.String" ismetaclassinstance="no" iscollection="no" preferredwidget="ingenias.editor.widget.CustomJComboBox">
				<defaultvalues>
					<value>yes</value>
					<value>no</value>					
				</defaultvalues>
				<label lang="es">Descripcion</label>
				<label lang="en">Description</label>
			</property>
			<preferredorder>					
				<order>MetaObjectType</order>	
				<order>Iscollection</order>
			</preferredorder>
		</properties>
		<graphics>
			<small-icon>images/miusecase.gif</small-icon>
			<normal-icon>images/iusecase.gif</normal-icon>
			<layout>					
				<properties>
					<property id="id" />
					<property id="MetaObjectType" />
					<property id="Iscollection" />
				</properties>
				<views>
					<content id="UML">
						##panel layout="BorderLayout(0,0)"  Background="white" border="LineBorder(Color.black,1)"#
						##vbox Background="white" constraints="BorderLayout.CENTER" #
						##panel Background="white"  HorizontalAlignment="CENTER" layout="FlowLayout(FlowLayout.CENTER,0,0)" #
						##stereotype text="MetaObjectTypeWrapper" HorizontalAlignment="CENTER" /#
						##/panel #
						##panel Background="white"  HorizontalAlignment="CENTER"  layout="FlowLayout(FlowLayout.CENTER,0,0)" #
						##label id="Id"/#
						##/panel#
						##linepanel Background="white"/#
						##linepanel Background="white" /#
						##/vbox#
						##/panel#	
					</content>		
					
					<content id="INGENIAS">
						##panel layout="BorderLayout(0,0)"  Background="white" border="LineBorder(Color.black,1)"#
						##vbox Background="white" constraints="BorderLayout.CENTER" #
						##panel Background="white"  HorizontalAlignment="CENTER" layout="FlowLayout(FlowLayout.CENTER,0,0)" #
						##stereotype text="MetaObjectTypeWrapper" HorizontalAlignment="CENTER" /#
						##/panel #
						##panel Background="white"  HorizontalAlignment="CENTER"  layout="FlowLayout(FlowLayout.CENTER,0,0)" #
						##label id="Id"/#
						##/panel#
						##linepanel Background="white"/#
						##linepanel Background="white" /#
						##/vbox#
						##/panel#	
					</content>		
				</views>							<order>id</order>			
			</layout>
		</graphics>
	</object>
	
	<object id="MetaDiagramTypeWrapper" inherits="TypeWrapper" instanciable="yes" keyfield="id" exampleid="myUseCase" package="UML">		
		<description>
			Describes an action in an activity diagram
		</description>
		<properties>			
			<property id="MetaDiagramType" type="MetaDiagram" ismetaclassinstance="yes" iscollection="no">
				<label lang="es">Descripcion</label>
				<label lang="en">Description</label>
			</property>			
			<property id="Iscollection" type="java.lang.String" ismetaclassinstance="no" iscollection="no" preferredwidget="ingenias.editor.widget.CustomJComboBox">
				<defaultvalues>
					<value>yes</value>
					<value>no</value>					
				</defaultvalues>
				<label lang="es">Descripcion</label>
				<label lang="en">Description</label>
			</property>
			<preferredorder>
				<order>MetaDiagramType</order>
				<order>Iscollection</order>
			</preferredorder>
		</properties>
		<graphics>
			<small-icon>images/miusecase.gif</small-icon>
			<normal-icon>images/iusecase.gif</normal-icon>